31042;Cacahuète enrobée de chocolat dragéifiée;;produits sucrés;chocolats et produits à base de chocolat;-;499;1,7;9,5;55,9;50,5;5,9;25;9,87;12,7;1,24;0,05;0,12;100;2,9;95;1,4;230;500;-;10,6;0,75;-;80,4;0,34;0,17;0,034;-
31066;Rocher chocolat fourré praliné;;produits sucrés;chocolats et produits à base de chocolat;-;558;1,1;6,53;51,4;49,2;3,88;35,3;15,5;17,3;2,48;0,061;0,14;120;3,4;82;1,2;200;430;< 0,5;10,4;< 0,25;0,5;22,9;0,099;0,22;0,092;-
31069;Chocolat noir aux fruits (orange, framboise, poire), tablette;;produits sucrés;chocolats et produits à base de chocolat;-;539;1,2;6,8;45,3;35,7;10,3;34,4;22,5;10,7;1,24;0,063;0,078;76;4;102;-;-;-;0,5;-;-;-;-;-;-;-;-
31070;Chocolat noir aux fruits secs (noisettes, amandes, raisins, praline), tablette;;produits sucrés;chocolats et produits à base de chocolat;-;567;0,9;8,69;40,7;38,2;8,4;39;17,5;15,8;2,07;0,07;0,03;64;8,7;140;2;230;510;< 0,5;18,7;1,09;0;41,7;0,087;0,052;0,05;-
31071;Barre chocolatée aux fruits secs;;produits sucrés;chocolats et produits à base de chocolat;-;494;4,42;7,23;57,6;45,1;1,53;26;9,53;9,88;1,94;0,057;0,38;122;1,3;13,6;0,64;198;47,3;0;-;0,03;0,3;0,11;0,036;0,19;0,035;-
31072;Chocolat noir fourrage confiseur à la menthe;;produits sucrés;chocolats et produits à base de chocolat;-;445;6,2;2,9;70,2;69;4;16;11;2,46;2,49;0,02;traces;14;3;48;0,7;70;150;< 0,5;17,8;-;0,14;13,9;0,042;0,03;0,032;-
31073;Gâteau moelleux fourré au chocolat et au lait, enrobé de chocolat, préemballé, rayon frais;;produits sucrés;chocolats et produits à base de chocolat;-;449;20,5;5,95;42,4;35,5;1,6;28;18;8,82;1,18;0,049;0,22;174;0,9;47,3;1,15;157;296;< 0,5;23;0,53;0,39;26,9;0,07;0,28;0,28;-
31074;Chocolat noir 70 % de cacao environ, de dégustation, tablette;;produits sucrés;chocolats et produits à base de chocolat;-;591;0,9;10,4;26,9;17,9;12,8;46,3;28,7;14;1,46;0,09;0,02;62;11;200;3;280;750;< 0,5;< 5;2,16;0;52;0,13;0,11;< 0,01;-
31080;Chocolat noir fourré praliné, tablette;;produits sucrés;chocolats et produits à base de chocolat;-;559;0,5;6,38;52,4;48,8;5,07;34,8;16,9;14,3;2,06;0,067;0,039;70;6,1;110;1,7;180;400;< 0,5;26,8;< 0,5;0,32;32,2;0,11;0,08;0,05;-
31084;Chocolat au lait fourré au praliné, tablette;;produits sucrés;chocolats et produits à base de chocolat;-;559;0,6;7,29;52,9;49,9;2,51;34,9;16,4;11,6;2,01;0,062;0,2;150;3,2;70;1,2;210;420;< 0,5;31,2;< 0,5;0,99;14,7;0,094;0,28;0,041;-
31085;Chocolat noir 40% de cacao et plus, à pâtisser, tablette;;produits sucrés;chocolats et produits à base de chocolat;-;546;0,9;6,39;51,4;41,6;8,76;33,1;22;10,1;1,01;0,069;0,015;46;4,35;130;1,3;186;300;0,28;54;0;-;12;0,07;0,07;0,03;1,44
31091;Bouchée/bonbon au chocolat fourrage gaufrettes ou biscuit;;produits sucrés;chocolats et produits à base de chocolat;-;521;-;6,5;55,1;42,9;4,92;29,4;17,8;-;-;-;0,32;40;3,6;-;-;-;-;< 1;-;-;-;-;-;-;-;-
31098;Barre chocolat au lait avec nougat;;produits sucrés;chocolats et produits à base de chocolat;-;532;0,6;5,8;60,5;60,1;2,9;29;17,4;8,89;1,1;0,09;0,11;150;2,3;50;0,97;160;260;< 0,5;31,5;< 0,5;0,37;19,2;0,073;0,21;0,07;-
31120;Chocolat, tablette (aliment moyen);;produits sucrés;chocolats et produits à base de chocolat;-;552;0,74;7,57;50,4;45,2;5,96;34,2;20,3;10,9;1,31;0,073;0,13;142;4,96;93,2;1,6;227;519;0,76;26,9;1,12;0,38;24,9;0,095;0,21;0,061;-
15058;Cacahuète caramélisée ou chouchou;;produits sucrés;confiseries non chocolatées;-;544;-;12,9;51,4;44,7;6,1;29,7;3,95;-;-;-;0,013;-;-;-;-;-;-;-;-;-;-;-;-;-;-;-
15201;Pâte d'amande, préemballée;;produits sucrés;confiseries non chocolatées;-;432;6,6;5,8;70,3;60,1;2,8;13,5;1,05;8,89;2,9;< 0,01;0,018;91;0,88;74;0,86;150;190;< 0,5;< 5;< 0,25;-;13,5;0,029;0,02;0,019;-
31007;Chewing-gum, sucré;;produits sucrés;confiseries non chocolatées;-;360;2,6;0,25;86,4;68,1;4;0,65;0,3;0,079;0,14;-;< 0,013;18;9,5;340;0,06;4,6;3,5;< 0,5;< 5;< 0,25;0;0;0;0;0;-
31014;Pâte de fruits;;produits sucrés;confiseries non chocolatées;-;336;15;1,69;76,6;69,2;3,9;1,8;0,17;< 0,0002;< 0,0002;< 0,0002;0,078;25;0,58;18;0,38;44;170;5,13;< 5;< 0,25;0;12;0,15;0,3;0,34;-
31021;Ecorce d'orange confite;;produits sucrés;confiseries non chocolatées;-;307;16;0,59;75,6;65,2;1,1;0,083;0,033;0,025;0,025;-;0,1;65;1,5;-;0,1;5;24;3;120;0;-;0;0,07;0,05;0;0
31023;Marron glacé;;produits sucrés;confiseries non chocolatées;-;320;18,2;0,89;77,5;55,3;2,67;0,54;0,063;< 0,01;< 0,01;< 0,01;0,066;8,1;0,28;5,7;0,14;17;54;< 0,5;< 5;< 0,25;-;33,2;< 0,015;< 0,01;0,012;-
31027;Fruit confit;;produits sucrés;confiseries non chocolatées;-;297;23,5;0,25;72,4;62,9;3,3;0,063;0,05;0;0;-;0,14;71;0,27;4,7;< 0,05;5,8;40;< 0,5;5,83;< 0,25;-;< 5;< 0,015;< 0,01;< 0,01;-
31028;Bonbon dragéifié;;produits sucrés;confiseries non chocolatées;-;378;-;0,53;89,9;71,9;0,13;1,94;0,98;-;-;-;0,096;-;-;-;-;-;-;-;-;-;-;-;-;-;-;-
31036;Dragée amande;;produits sucrés;confiseries non chocolatées;-;465;1,45;5,25;75,7;68,3;4,6;14,7;1,25;10,5;2,89;-;0,025;84;2,5;48;1,02;165;262;0;0;0;-;16;0,1;0,14;0,05;7,77
31050;Guimauve ou marshmallow;;produits sucrés;confiseries non chocolatées;-;336;16,4;3,31;80,7;69,9;0,011;0,081;0,000013;0,051;0,03;< 0,01;0,078;3;0,23;2;0,04;8;5;0;0;0;0;1;0,001;0,001;0,003;-
31052;Praline;;produits sucrés;confiseries non chocolatées;-;483;-;8,7;67,7;66,3;-;19,7;1,5;-;-;-;0,0009;-;-;-;-;-;-;-;-;-;-;-;-;-;-;-
31054;Chewing-gum, sans sucres;;produits sucrés;confiseries non chocolatées;-;206;4,3;0,22;76;0,088;1,95;0,25;0,17;0,024;0,059;-;0,031;3700;5,2;130;0,09;60;73;0;0;0;0;31,5;0,11;< 0,01;< 0,01;-
31059;Bonbon dur et sucette;;produits sucrés;confiseries non chocolatées;-;384;1,3;0,16;95,3;70,4;0,91;0,18;0,087;0;0;< 0,1;0,091;3;0,3;3;0,01;3;5;0;0;0;0;0;0,004;0,003;0,003;-
31060;Bonbon gélifié;;produits sucrés;confiseries non chocolatées;-;339;14,9;4,88;76,9;58,4;1,5;0,53;0,25;0,14;0,044;0,002;0,02;< 5;< 0,25;1,08;< 0,5;6,72;13;< 2;< 30;0;< 0,1;-;0,05;< 0,02;< 0,04;-
31081;Bonbon tendre, au caramel;;produits sucrés;confiseries non chocolatées;-;415;1,42;2,23;79,1;59,8;0,19;9,98;5,63;1,72;0,19;0,013;0,56;95,6;0,55;17,4;0,3;77,4;154;< 0,5;-;< 0,5;0,08;31,8;< 0,04;0,14;0,16;0,23
31092;Calisson d'Aix en Provence;;produits sucrés;confiseries non chocolatées;-;440;10;7,97;59,8;49,6;3,1;18;1,74;12;3,5;< 0,01;0,032;81;-;67;6,4;160;210;< 0,5;249;< 0,25;-;29;0,039;0,047;0,012;-
31093;Guimauve ou marshmallow, enrobé de chocolat;;produits sucrés;confiseries non chocolatées;-;383;14;4,4;67,5;56,4;0,45;10,5;6,5;-;-;-;0,081;-;-;-;-;-;-;-;-;-;-;-;-;-;-;-
31094;Bonbon dur, au caramel;;produits sucrés;confiseries non chocolatées;-;416;2,7;1,33;86,6;72,7;0,13;7,09;4,77;1,75;0,2;< 0,1;0,87;-;0;-;0;0;-;0;0;0;-;0;0;0;0;0
31097;Bonbon tendre;;produits sucrés;confiseries non chocolatées;-;392;7,3;0,94;84,3;66,5;1,5;5,1;2,99;1,36;0,3;0,012;0,063;< 5;< 0,25;< 1;< 0,5;11,8;6,62;< 2;< 30;-;< 0,1;-;< 0,02;< 0,02;< 0,04;-
31112;Bonbon gélifié à la réglisse, type rouleau ou batonnet;;produits sucrés;confiseries non chocolatées;-;347;-;3,62;75,6;46,3;8,18;1,55;0,73;-;0;-;1,05;-;-;-;-;-;-;-;-;-;-;-;-;-;-;-
31121;Chewing-gum, sans précision sur la teneur en sucres (aliment moyen);;produits sucrés;confiseries non chocolatées;-;263;3,67;0,23;79,9;25,4;2,71;0,4;0,22;0,044;0,088;-;0,022;2330;6,8;208;0,079;39,4;47,1;< 0,19;< 1,86;< 0,093;0;19,8;0,067;< 0,0063;< 0,0063;-
31122;Bonbon tendre, au caramel enrobé de chocolat;;produits sucrés;confiseries non chocolatées;-;446;6;3,29;69,6;55,5;1,8;16,8;11,1;4,87;0,81;-;0,4;-;-;-;-;-;-;-;-;-;-;-;-;-;-;-
31124;Bonbon dur type collier, sifflet, sucette, pastille, au dextrose;;produits sucrés;confiseries non chocolatées;-;376;-;0,018;91,1;85,6;0;1,35;1,18;-;-;-;0,3;-;-;-;-;-;-;-;-;-;-;-;-;-;-;-
31125;Pastille rafraîchissante, sans sucres;;produits sucrés;confiseries non chocolatées;-;241;-;0,08;96,3;0,19;0,4;0,65;0,61;-;-;-;0,033;-;-;-;-;-;-;-;-;-;-;-;-;-;-;-
31126;Pastille rafraîchissante, sucrée;;produits sucrés;confiseries non chocolatées;-;390;-;0,13;96,7;93,8;0,27;0,37;0,27;-;-;-;0,036;-;-;-;-;-;-;-;-;-;-;-;-;-;-;-
31127;Nougat tendre;;produits sucrés;confiseries non chocolatées;-;437;-;6,98;69,3;60,8;3,27;13,9;1,21;-;-;-;0,045;-;-;-;-;-;-;-;-;-;-;-;-;-;-;-
31128;Bonbon dur et sucette, sans sucres;;produits sucrés;confiseries non chocolatées;-;235;-;0,081;96;0,067;0,000019;0,44;0,3;-;-;-;0,073;-;-;-;-;-;-;-;-;-;-;-;-;-;-;-
11299;Crème de pruneaux, préemballée;;produits sucrés;confitures et assimilés;-;240;-;1,4;55;53;5;0,45;0;-;-;-;0,01;-;-;-;-;-;-;-;-;-;-;-;-;-;-;-
15013;Crème de marron ou confiture de châtaigne, préemballée;;produits sucrés;confitures et assimilés;-;278;32,8;0,95;65,9;51,5;2,28;0,66;0,13;-;-;-;0,014;11,3;1,7;12,2;0,3;-;174;6,29;0;-;-;30;-;-;-;-
30886;Gelée, autres fruits ou mélange de fruits (extra ou classique);;produits sucrés;confitures et assimilés;-;252;-;0,1;61,9;60,9;1,25;0,1;0,025;-;0;-;0,0075;-;-;-;-;-;-;-;-;-;-;-;-;-;-;-
30887;Confiture, autres fruits ou mélange de fruits, allégée en sucres (extra ou classique);;produits sucrés;confitures et assimilés;-;162;58,2;0,75;38;38;1,8;0,21;0,026;-;-;-;0,023;13;0,2;6,7;0,06;12;110;9,57;122;< 0,25;-;-;< 0,015;< 0,01;0,019;-
30888;Marmelade ou confiture d'autres agrumes ou mélange d'agrumes (extra ou classique);;produits sucrés;confitures et assimilés;-;-;-;0,33;59,5;55,5;0,99;0,2;0,044;-;-;-;0,0089;-;-;-;-;-;-;-;-;-;-;-;-;-;-;-
30889;Marmelade ou confiture d'orange, allégée en sucres;;produits sucrés;confitures et assimilés;-;-;-;0,25;40,6;39,9;1,03;0,063;0,000025;-;-;-;0,015;-;-;-;-;-;-;-;-;-;-;-;-;-;-;-
30990;Confiture de mûre (extra ou classique);;produits sucrés;confitures et assimilés;-;245;38,5;0,44;58,3;56,9;1,3;0,63;0,31;0,11;0,083;0,015;0,0075;15,6;0,37;12,5;< 0,5;11;94,4;6,1;< 30;< 0,25;-;-;< 0,02;< 0,02;0,05;-
30991;Gelée de mûre (extra ou classique);;produits sucrés;confitures et assimilés;-;245;37,2;0,53;60;57,4;0,73;0,28;0,025;-;0;-;0,0066;-;-;-;-;-;-;-;-;-;-;-;-;-;-;-
30992;Confiture de rhubarbe (extra ou classique);;produits sucrés;confitures et assimilés;-;239;-;0,26;58,6;57,7;1,53;0,057;0,0015;-;-;-;0,01;-;-;-;-;-;-;-;-;-;-;-;-;-;-;-
30993;Confiture de pêche (extra ou classique);;produits sucrés;confitures et assimilés;-;242;-;0,27;59,5;57,4;1,16;0,075;0,0013;-;0;-;0,0083;-;-;-;-;-;-;-;-;-;-;-;-;-;-;-
30994;Confiture de figue (extra ou classique);;produits sucrés;confitures et assimilés;-;243;38;0,63;59,1;56,8;1,31;0,17;0,033;-;-;-;0,012;-;-;-;-;-;-;-;-;-;-;-;-;-;-;-
30995;Confiture de fraise, allégée en sucres;;produits sucrés;confitures et assimilés;-;166;54,3;0,31;40,3;39,6;1,37;0,1;0,032;0,036;-;0,028;0,024;12,2;< 0,1;8,5;< 0,1;17;61,7;< 1;< 50;-;-;-;-;< 0,05;< 0,05;< 0,1
30996;Confiture d'abricot, allégée en sucres;;produits sucrés;confitures et assimilés;-;167;55,2;0,41;40,5;39,5;1,33;0,067;0,029;0,036;-;0,019;0,028;12,4;< 0,1;5,5;< 0,1;8,6;89,8;< 1;99;-;-;-;-;< 0,05;< 0,05;0,28
30997;Confiture de framboise, allégée en sucres;;produits sucrés;confitures et assimilés;-;167;-;0,68;39,2;37,9;2,98;0,14;0,034;-;-;-;0,024;-;-;-;-;-;-;-;-;-;-;-;-;-;-;-
30998;Gelée de framboise (extra ou classique);;produits sucrés;confitures et assimilés;-;249;-;0,56;61;59,3;0,86;0,1;0,0013;-;0;-;0,0056;-;-;-;-;-;-;-;-;-;-;-;-;-;-;-
30999;Confiture ou marmelade, tout type de fruits, sans précision sur la teneur en sucres (aliment moyen);;produits sucrés;confitures et assimilés;-;235;40,5;0,36;57,1;55,7;1,34;0,27;0,068;-;0,046;-;0,015;12,5;0,18;6,4;0,068;9,82;88,8;15,2;38,4;-;-;-;-;0,0074;0,018;-
31006;Confiture ou marmelade ou gelée, tout type de fruits, non allégée en sucres (aliment moyen);;produits sucrés;confitures et assimilés;-;244;38,7;0,33;59,3;57,7;1,29;0,28;0,073;-;0,046;-;0,014;-;-;-;-;-;-;16,2;-;-;-;-;-;-;-;-
31024;Confiture de fraise (extra ou classique);;produits sucrés;confitures et assimilés;-;248;38,4;0,25;60,5;60,1;0,7;0,5;0,11;0,15;0,14;0,05;0,018;9;0,17;5,7;< 0,05;10;77;11,4;< 5;-;-;-;< 0,015;< 0,01;< 0,01;-
31037;Confiture d'abricot (extra ou classique);;produits sucrés;confitures et assimilés;-;246;39,2;0,25;59,7;56,8;1,1;0,3;0,029;0,11;0;0;0,013;8,7;0,14;4,4;0,07;7,7;110;6,42;82,1;< 0,25;-;-;< 0,015;< 0,01;0,022;-
31038;Confiture de cerise (extra ou classique);;produits sucrés;confitures et assimilés;-;238;39,5;0,48;58,1;57,5;1,1;0,19;0,000022;-;-;-;0,013;12;0,22;7,1;< 0,05;16;110;19,6;54,8;-;-;-;0,024;0,013;< 0,01;-
31039;Marmelade d'orange ou confiture d'orange (extra ou classique);;produits sucrés;confitures et assimilés;-;245;38,1;0,25;59,3;56,9;1,5;0,4;0,14;0,13;0,03;< 0,01;0,015;33;0,08;4,2;< 0,05;3,8;49;8,92;< 5;< 0,25;0;-;< 0,015;< 0,01;0,02;-
31040;Confiture de lait;;produits sucrés;confitures et assimilés;-;340;25,4;6,84;61,7;49,7;0;7,35;4,53;2,14;0,38;0,05;0,32;251;0,17;22;0,79;193;350;2,6;-;0,2;0,31;-;0,016;0,41;0,016;-
31053;Confiture de prune, par ex. mirabelle, quetsche, reine-claude (extra ou classique);;produits sucrés;confitures et assimilés;-;240;39,3;0,28;58,9;58;1,27;0,089;0,029;-;-;-;0,011;-;-;-;-;-;-;-;-;-;-;-;-;-;-;-
31062;Confiture de framboise (extra ou classique);;produits sucrés;confitures et assimilés;-;232;39,9;0,56;55,2;55,2;2,69;0,17;0,071;-;-;-;0,013;9,9;0,28;9,5;0,12;11;100;2,93;< 5;-;-;-;0,019;0,012;0,029;-
31068;Confiture de myrtille (extra ou classique);;produits sucrés;confitures et assimilés;-;245;37,8;0,25;58,9;58,9;2,1;0,4;0,047;-;-;-;< 0,013;8,7;0,14;3,2;0,06;6,6;35;< 0,5;< 5;< 0,25;-;-;< 0,015;< 0,01;< 0,01;-
31082;Préparation de fruits divers (en taux de sucres : confitures allégées en sucres < préparations de fruits < confitures);;produits sucrés;confitures et assimilés;-;195;52,9;0,48;47,3;46,2;1,94;0,17;0,036;-;-;-;0,032;-;-;-;-;-;-;-;-;-;-;-;-;-;-;-
31083;Confiture, autres fruits ou mélange de fruits (extra ou classique);;produits sucrés;confitures et assimilés;-;244;38,4;0,36;59,8;57,3;1,47;0,15;0,06;-;0;-;0,017;-;-;-;-;-;-;39;-;-;-;-;-;-;-;-
31095;Gelée de groseille (extra ou classique);;produits sucrés;confitures et assimilés;-;244;37,9;0,25;59,7;58,7;< 0,5;0,044;0,000029;-;0;-;< 0,013;9,8;0,16;3,8;< 0,05;5,4;84;1,79;< 5;< 0,25;-;-;< 0,015;< 0,01;0,014;-
31129;Préparation aux fruits divers (35% de fruits min, sucres et autre(s) ingrédient(s));;produits sucrés;confitures et assimilés;-;204;-;0,81;47,4;45;2,8;0,75;0,089;-;-;-;0,028;-;-;-;-;-;-;-;-;-;-;-;-;-;-;-
7225;Pain brioché ou viennois, artisanal;;produits sucrés;viennoiseries;-;338;27,7;8,89;48,6;7,51;1,9;11,2;6,25;3,01;0,97;0,079;1,14;47,8;0,92;20,4;0,83;113;156;< 2;91;< 0,6;< 0,1;-;0,1;0,06;0,13;-
7600;Viennoiserie (aliment moyen);;produits sucrés;viennoiseries;-;385;22,6;7,63;49;12,9;2,43;17;8,33;5,45;1,68;0,26;1,03;40,3;1,71;22,2;0,72;100;142;0,49;112;0,13;0,15;28;0,12;0,058;0,037;-
7603;Croissant, sans précision (aliment moyen);;produits sucrés;viennoiseries;-;417;21,2;6,56;46,2;7,49;2,41;22,1;14;5,53;1,09;0,11;1,19;23,5;0,74;15,7;0,56;80,9;123;0,61;67,4;< 0,24;0,12;21,3;0,073;0,031;0,033;-
7615;Croissant ordinaire, artisanal;;produits sucrés;viennoiseries;-;412;21,4;6,33;47,6;7,88;1,8;21,1;11,6;6,52;1,89;0,12;1,31;21;0,85;17;0,63;88;130;< 0,5;70,2;< 0,25;0,089;32,8;0,062;< 0,01;0,046;-
7616;Croissant ordinaire, préemballé;;produits sucrés;viennoiseries;-;398;21,4;6,95;46,7;8,33;4,1;19,1;9,33;6,08;2,14;0,16;1,16;58;0,79;18,3;0,62;87,1;131;< 2;259;traces;< 0,1;5,2;0,22;< 0,1;< 0,03;-
7619;Croissant pur beurre, sans précision (aliment moyen);;produits sucrés;viennoiseries;-;420;21,1;6,61;45,7;7,3;2,5;22,6;15,1;5,14;0,73;0,11;1,16;22;0,7;15;0,53;78;120;0,71;53;< 0,25;0,13;18,3;0,066;0,039;0,029;-
7620;Croissant pur beurre, artisanal;;produits sucrés;viennoiseries;-;420;21,1;6,61;45,7;7,3;2,5;22,6;15,1;5,14;0,73;0,11;1,16;22;0,7;15;0,53;78;120;0,71;53;< 0,25;0,13;18,3;0,066;0,039;0,029;-
7621;Croissant pur beurre, préemballé;;produits sucrés;viennoiseries;-;388;24,1;6,27;45,7;9,79;3,7;18,9;11,1;4;0,83;0,12;0,91;32,4;0,8;19,4;0,65;92,7;139;< 2;281;traces;< 0,1;4,3;0,16;< 0,1;< 0,03;-
7650;Croissant aux amandes, artisanal;;produits sucrés;viennoiseries;-;449;22,1;7,62;36,5;14,4;3,7;29,1;14,9;10,4;2,88;0,083;0,79;55,7;1,1;36,6;0,76;116;174;0,044;64,3;0,44;0,12;35,6;0,093;0,15;0,13;4,02
7710;Pain au lait, artisanal;;produits sucrés;viennoiseries;-;376;23,7;8,55;49;9,62;1,5;15,4;8,34;4,74;1,36;0,13;1,1;37,1;1,1;20,3;< 1;114;171;0;< 50;< 0,2;0,82;46;0,07;0,13;0,17;-
7711;Pain au lait, préemballé;;produits sucrés;viennoiseries;-;357;23,1;8,69;50,5;11,5;3,5;12,3;4,14;5,1;2,19;0,53;1,06;49,1;0,85;19,5;0,74;96,3;140;< 2;40;traces;< 0,1;-;0,2;< 0,1;< 0,03;-
7712;Pain au lait aux pépites de chocolat, préemballé;;produits sucrés;viennoiseries;-;375;21,4;8,25;49,6;18,9;3,8;14,7;5,31;6,05;2,23;0,55;0,9;72,9;2,7;30,6;0,89;137;211;< 2;82;traces;< 0,1;-;0,24;0,16;< 0,03;-
7719;Panettone (brioche italienne aux raisins secs et écorces d'orange confite), préemballée;;produits sucrés;viennoiseries;-;352;24,9;6,88;50,6;25,9;3,4;12,7;7,04;3,04;0,97;0,08;0,46;39,4;1,3;19,2;0,63;89,8;227;< 2;< 30;traces;< 0,1;3,7;< 0,079;< 0,1;< 0,03;-
7720;Pain aux raisins (viennoiserie), artisanal;;produits sucrés;viennoiseries;-;345;25,8;5,81;53,4;20,9;1,4;11,5;5,66;2,94;0,89;0,12;0,81;32,1;0,77;18,6;< 1;100;278;0;< 50;< 0,2;0,54;132;0,07;0,18;0,08;-
7730;Pain au chocolat, artisanal;;produits sucrés;viennoiseries;-;423;20;7,47;45,4;12,8;3;22,5;14,7;5,43;0,85;0,11;0,98;23;4,1;29;0,78;95;160;< 0,5;53,5;< 0,25;0,09;33,8;0,058;< 0,01;< 0,01;-
7733;Pain au chocolat, préemballé;;produits sucrés;viennoiseries;-;421;19;6,28;48,6;13;2,72;21,4;12,5;6,22;1,41;0,11;0,98;91;3,2;32;0,84;93;150;< 0,5;335;< 0,25;0,064;16,8;0,13;0,028;0,024;-
7735;Brioche (ou briochettes) aux pépites de chocolat ou fourrée au chocolat, préemballée;;produits sucrés;viennoiseries;-;352;24;8,17;51,1;17,4;2,98;12,1;3,08;7,16;1,83;< 0,01;0,91;52;3,5;31;0,84;110;170;< 0,5;78,1;< 0,25;0,16;22,3;0,1;0,062;0,029;-
7738;Brioche fourrée aux fruits, préemballée;;produits sucrés;viennoiseries;-;326;25,8;5,81;52,4;24,4;5,5;9;2,15;4,64;1,7;0,39;0,99;19,6;0,68;12,9;0,6;75,7;108;< 2;< 30;traces;< 0,1;7,8;0,25;< 0,1;< 0,03;-
7739;"Brioche fourrée crème pâtissière (type ""chinois""), préemballée";;produits sucrés;viennoiseries;-;267;37,7;5,81;45,7;20,3;3,4;6;1,9;2,74;1,23;0,29;0,83;56;0,55;14,5;0,52;74,1;137;< 2;179;traces;< 0,1;8,7;0,13;< 0,1;0,03;-
7740;Brioche nature, préemballée;;produits sucrés;viennoiseries;-;356;23,7;7,99;52,7;14,5;2,09;12,1;4,68;4,3;1,75;0,4;0,98;32;0,94;18;0,74;91;120;< 0,5;158;< 0,25;0,21;23,9;0,14;0,053;0,032;-
7742;Brioche nature, artisanale;;produits sucrés;viennoiseries;-;420;20,1;11,3;50,7;5,7;< 0,5;19,1;8,51;4,92;1,14;0,16;1,47;30;1,15;25,5;0,68;138;188;< 0,5;58;< 0,5;0,32;53;0,11;0,2;0,12;-
7744;Couronne des rois (brioche) aux fruits confits, préemballée;;produits sucrés;viennoiseries;-;353;25;7,2;52,8;19,6;1,35;12,3;6,1;4,69;1,46;-;0,89;-;-;-;-;-;-;-;-;-;-;-;-;-;-;-
7745;Brioche pur beurre (ex : gâche vendéenne) nature, préemballée;;produits sucrés;viennoiseries;-;361;24;8,21;51,1;13;2,03;13,3;8,71;3,37;0,89;0,09;0,99;30;0,85;19;0,72;96;110;< 0,5;132;< 0,25;0,22;48,4;0,14;0,068;0,052;-
7746;Brioche, sans précision (aliment moyen);;produits sucrés;viennoiseries;-;363;23,5;8,41;52,1;13,9;1,94;13;5,09;4,69;1,64;0,32;1,04;34;1,24;20,5;0,74;100;136;< 0,54;132;< 0,28;0,21;27,9;0,13;0,077;0,045;-
23467;Chouquette;;produits sucrés;viennoiseries;-;408;24,4;9,13;40,6;18,4;1,5;22,9;11;7,17;2,09;0,17;1,06;54,6;1,7;15,3;0,82;156;122;< 2;60;0,85;0,39;-;0,06;0,18;0,04;-
23480;Chausson aux pommes;;produits sucrés;viennoiseries;-;360;33,6;4,17;42,2;11,2;3,1;18,7;10,3;4,48;1,21;0,061;0,87;39;0,8;10;0,3;150;106;5,36;63,6;0,32;0;5,15;0,1;0,051;0,065;1,21
7355;Galette de riz soufflé, nappée de chocolat;;produits sucrés;biscuits sucrés;-;494;1,7;7,32;60,7;26,3;5,1;23,2;13;7,13;1,11;0,06;0,048;65,3;3,9;111;1,8;250;367;< 2;< 30;traces;0,24;12,3;0,12;0,14;0,3;-
7356;Galette de maïs soufflé, nappée de chocolat;;produits sucrés;biscuits sucrés;-;481;-;7,3;63,2;22,8;5,05;20,8;12,2;-;-;-;0,063;-;-;89,5;-;-;-;-;-;-;-;-;-;-;-;-
7412;Tartine craquante, extrudée et grillée, fourrée au chocolat;;produits sucrés;biscuits sucrés;-;445;3,8;7,88;65,4;29,7;5,3;15,6;5,84;6,57;2,64;0,53;0,19;144;7,5;71,9;1,1;218;357;< 2;< 30;traces;< 0,1;4,6;0,11;0,16;0,15;-
7413;Tartine craquante, extrudée et grillée, fourrée aux fruits;;produits sucrés;biscuits sucrés;-;372;11,6;4,22;74,9;31,3;2,6;5,1;2,54;1,69;0,76;0,06;0,23;125;0,53;14,7;< 0,5;121;136;< 2;< 30;traces;< 0,1;4,6;< 0,079;< 0,1;< 0,03;-
23027;Macaron sec;;produits sucrés;biscuits sucrés;-;436;-;6,9;77,7;74;3;10,2;0,6;-;-;-;0,2;-;-;-;-;-;-;-;-;-;-;-;-;-;-;-
24000;Biscuit sec, sans précision;;produits sucrés;biscuits sucrés;-;433;2,83;7,83;67,8;25;3;13,8;3,46;7,67;1,87;0,33;1,02;10;0,4;14;0,6;190;157;0;-;0;0,05;14;0,35;0,33;0,022;-
24001;Biscuit sec nature;;produits sucrés;biscuits sucrés;-;438;2,2;7,13;74,9;25,4;3,3;11,5;5,31;4,43;1,45;0,05;0,74;25;0,86;17;< 0,5;92,2;139;< 2;< 30;traces;< 0,1;-;0,08;< 0,02;< 0,03;-
24002;Biscuit sec à teneur garantie en vitamines;;produits sucrés;biscuits sucrés;-;457;1,8;9,63;72,3;23,3;0,75;14,2;6,07;3,98;3,26;0,25;0,16;-;2;54;1,5;149;275;3;< 30;0,55;< 0,08;212;2,6;1,8;3,35;-
24003;Biscuit sec à teneur garantie en vitamines et minéraux;;produits sucrés;biscuits sucrés;-;472;1,28;10,8;61,1;22,1;3,5;19,8;8,44;6,75;3,32;0,12;0,44;-;6,4;195;1,9;213;256;< 1;< 30;< 0,5;< 0,08;157;1,7;1,95;3,7;-
24004;Biscuit sec aux fruits, hyposodé ou à teneur réduite en sel;;produits sucrés;biscuits sucrés;-;448;4,1;8,88;64;17,9;5,4;16;1,45;8,47;4,43;1;0,02;43,8;1,5;34,4;0,82;118;427;< 2;< 30;traces;< 0,1;-;0,13;0,05;0,05;-
24006;Biscuit sec au soja, enrichi en vitamines et minéraux;;produits sucrés;biscuits sucrés;-;444;3,4;10,9;60,3;20,3;6,6;16,1;2,22;8,69;4,54;0,88;0,71;179;3;149;2,4;316;423;3;< 30;-;-;-;0,46;0,29;0,73;-
24008;Biscuit sec fourré aux fruits, allégé en matière grasse;;produits sucrés;biscuits sucrés;-;391;8,8;4,69;75,3;39,9;3;7,2;2,82;2,95;1,43;0,14;0,58;59;< 1;15,6;< 1;94;152;-;< 50;< 0,2;0,35;49,6;0,2;0,05;< 0,05;-
24009;Spéculoos;;produits sucrés;biscuits sucrés;-;476;0,9;5,63;71,2;32,5;3;18,1;7,81;7,52;2,59;0,31;0,92;14;0,73;14,9;< 0,5;64,3;103;5,72;< 30;traces;0,39;-;< 0,02;< 0,02;< 0,03;-
24010;Biscuit sec, avec matière grasse végétale;;produits sucrés;biscuits sucrés;-;436;1,4;7,23;74;23,4;3,1;11,7;5,4;-;-;-;0,75;57,7;2,16;34,5;0,92;142;89,7;-;-;-;-;-;-;-;-;-
24011;Biscuit sec, assortiment;;produits sucrés;biscuits sucrés;-;515;1,6;6,44;61,4;39,4;2,9;26,4;6,21;15,3;3,59;0,34;0,46;55;2,6;35;0,66;110;200;< 0,5;14,6;< 0,25;0,21;48,7;0,1;0,14;0,031;-
24012;Biscuit sec au chocolat, sans sucres ajoutés, avec édulcorants, enrichi en vitamines;;produits sucrés;biscuits sucrés;-;448;-;6,78;64,6;1,72;3,71;21,8;8,99;-;-;-;0,57;-;-;65;-;-;-;-;-;3,2;1,4;60,7;0,57;0,52;0,95;-
24013;Biscuit sec, sans sucres ajoutés, avec édulcorant;;produits sucrés;biscuits sucrés;-;429;-;6,23;72,1;0,11;3,93;15,7;3,3;-;-;-;0,79;-;2,3;-;-;-;-;-;-;-;-;-;-;-;-;-
24014;Biscuit sec avec tablette de chocolat et fourrage au lait;;produits sucrés;biscuits sucrés;-;512;1,4;6,75;62,3;35,6;2,7;25,6;14,9;8,18;1,89;0,18;0,45;89,6;3;38;0,81;-;253;< 2;< 30;traces;0,26;-;0,09;0,22;0,04;-
24015;Biscuit sec petit beurre;;produits sucrés;biscuits sucrés;-;450;1,4;7,78;73,4;22;2,54;13,3;8,61;2,79;0,62;0,07;1,04;34;0,82;18;0,52;100;150;< 0,5;-;< 0,25;0,092;19,1;0,082;0,035;0,026;-
24016;Biscuit sec avec tablette de chocolat;;produits sucrés;biscuits sucrés;-;485;1,2;5,56;68,8;40,8;3,5;20;11,3;6,68;1,56;0,16;0,35;59,4;3,1;33;0,67;102;198;< 2;< 30;traces;0,2;-;0,09;0,1;0,03;-
24017;Biscuit sec petit beurre au chocolat (tablette ou pépites);;produits sucrés;biscuits sucrés;-;496;1;6,88;63,8;35,4;4;22,8;14,2;6,28;0,99;0,076;0,59;91,8;4,6;45,7;0,89;180;288;< 2;54;traces;< 0,1;-;0,08;0,19;0,04;-
24018;Biscuit sec sans gluten, petit beurre;;produits sucrés;biscuits sucrés;-;460;-;3,8;79,3;21;0,9;14;8,5;-;-;-;1,1;-;-;-;-;-;-;-;-;-;-;-;-;-;-;-
24019;Biscuit sec sans gluten, au chocolat;;produits sucrés;biscuits sucrés;-;504;-;5,04;64;27,5;2,95;24,7;12,2;-;-;-;0,5;-;-;-;-;-;-;-;-;-;-;-;-;-;-;-
24020;Biscuit sec aux céréales complètes;;produits sucrés;biscuits sucrés;-;462;3,1;7,75;63;19,5;6,6;18,4;4,97;8,01;3,67;0,75;0,37;44,5;1,8;60,8;1,4;188;205;< 2;< 30;traces;0,2;13;0,15;< 0,1;0,07;-
24021;Biscuit sec petit beurre au blé complet;;produits sucrés;biscuits sucrés;-;439;2,2;9,25;66,6;18,8;7,2;13,4;2,01;6,75;3,57;0,8;0,37;31,9;2,2;71,8;2;231;280;< 2;< 30;traces;0,15;3,9;0,18;< 0,1;0,08;-
24028;Biscuit sec au sésame, non enrichi;;produits sucrés;biscuits sucrés;-;496;-;9,19;60;21;4,84;23,3;6,27;-;-;-;0,55;-;2,3;73,5;1,9;195;-;-;-;-;-;2,3;-;-;-;-
24029;Biscuit sec au sésame, enrichi en vitamines et minéraux;;produits sucrés;biscuits sucrés;-;485;-;11,5;60;18,5;4,9;21;2,05;-;-;-;0,68;350;7;179;-;-;-;-;-;-;-;41,9;0,33;-;0,57;-
24031;Biscuit sec sans chocolat, allégé en matière grasse;;produits sucrés;biscuits sucrés;-;388;1,5;6;71;35;13;6;2,5;2,59;0,91;0,1;0,34;199;< 1;25,5;< 1;239;211;-;< 50;< 0,2;0,97;11,7;0,17;0,11;< 0,05;2,07
24034;Biscuit sec pour petit déjeuner, sans chocolat, non enrichi;;produits sucrés;biscuits sucrés;-;452;2,1;7,81;65,8;21;5,5;16,3;2,83;8,8;3,89;0,87;1,19;250;4;140;0,94;240;190;< 0,5;< 5;< 0,25;0,033;13,9;0,13;0,01;0,071;-
24035;Biscuit sec pour petit déjeuner, allégé en sucres;;produits sucrés;biscuits sucrés;-;444;-;7,78;66,2;19,5;6,7;15;5;-;-;-;0,69;200;4,2;112;-;200;-;-;-;-;-;3,6;0,33;-;-;4,17
24036;Biscuit sec au chocolat, non enrichi;;produits sucrés;biscuits sucrés;-;507;1,7;7,75;59,5;44,2;3,9;25,6;9,7;12,4;2,88;0,16;0,39;112;3,3;63,2;1,3;176;422;5,4;< 30;traces;0,32;-;0,05;< 0,01;0,06;-
24037;Biscuit sec fourré à la pâte ou purée de fruits (ex : figue);;produits sucrés;biscuits sucrés;-;421;11,1;4,93;71,6;27,2;2;12,3;5,19;4,25;1,41;0,083;0,38;64;1;294;0,3;37;269;< 0,5;7;0;< 0,08;21;0,091;0,055;0,31;-
