4050;Chips de pommes de terre nature ou aromatisées, sans sel ajouté;;fruits, légumes, légumineuses et oléagineux;pommes de terre et autres tubercules;-;503;-;6,2;47,6;0,83;5,05;30,8;2,87;-;-;-;0,033;-;-;-;-;-;-;-;-;-;-;-;-;-;-;-
4052;Potatoes ou wedges ou quartiers de pommes de terre épicés, surgelées, à cuire;;fruits, légumes, légumineuses et oléagineux;pommes de terre et autres tubercules;-;141;-;2,48;20,3;0,52;2,64;5;0,59;-;-;-;0,62;-;-;-;-;-;-;-;-;-;-;-;-;-;-;-
4053;Pomme de terre grenaille, préfrite, surgelée, à cuire;;fruits, légumes, légumineuses et oléagineux;pommes de terre et autres tubercules;-;133;-;2,4;17,9;2,23;2,16;5,3;1,02;-;-;-;0,42;-;-;-;-;-;-;-;-;-;-;-;-;-;-;-
4101;Patate douce, crue;;fruits, légumes, légumineuses et oléagineux;pommes de terre et autres tubercules;-;81,2;77,3;1,57;17,1;4,18;3;0,05;0,018;0,001;0,014;0,001;0,14;30;0,61;25;0,3;47;337;2,4;8510;0;0;-;0,078;0,061;0,21;-
4102;Patate douce, cuite;;fruits, légumes, légumineuses et oléagineux;pommes de terre et autres tubercules;-;79,1;78;1,69;16,3;6,11;2,9;0,15;0,042;0,002;0,077;-;0,079;32,5;0,71;22,5;0,26;43;353;16,2;10500;0;0;-;0,082;0,077;0,23;-
4103;Patate douce, purée, cuisinée à la crème;;fruits, légumes, légumineuses et oléagineux;pommes de terre et autres tubercules;-;79,8;-;1,1;12,1;7,5;4,5;2;1,4;-;-;-;0,56;-;-;-;-;-;-;-;-;-;-;-;-;-;-;-
20050;Topinambour, cuit;;fruits, légumes, légumineuses et oléagineux;pommes de terre et autres tubercules;-;69,3;80,2;1,8;14,4;1,7;2,2;0,01;0;0,004;0,001;-;0,09;32,9;0,2;14,1;0,34;64;452;3,2;< 50;0;0;-;< 0,05;0,03;0,04;-
20196;Topinambour, cru;;fruits, légumes, légumineuses et oléagineux;pommes de terre et autres tubercules;-;74,7;78;2;15,8;9,6;1,6;0,01;0;0,004;0,001;0,00021;0,01;14;3,4;17;0,12;78;429;4;12;0;0;-;0,2;0,06;0,077;-
53101;Banane plantain, cuite;;fruits, légumes, légumineuses et oléagineux;pommes de terre et autres tubercules;-;125;67,3;0,79;28,9;14;2,3;0,18;0,069;0,015;0,033;-;0,013;2;0,58;32;0,13;28;465;10,9;369;0;0;-;0,046;0,052;0,24;-
53200;Taro, tubercule, cru;;fruits, légumes, légumineuses et oléagineux;pommes de terre et autres tubercules;-;105;70,6;1,5;22,4;0,4;4,1;0,2;0,041;0,016;0,083;-;0,028;43;0,55;33;0,23;84;591;4,5;35;0;0;-;0,095;0,025;0,28;-
53201;Taro, tubercule, cuit;;fruits, légumes, légumineuses et oléagineux;pommes de terre et autres tubercules;-;131;63,8;0,52;29,5;0,49;5,1;0,11;0,023;0,009;0,046;-;0,038;18;0,72;30;0,27;76;484;5;39;0;0;-;0,11;0,028;0,33;-
53502;Igname, pelée, crue;;fruits, légumes, légumineuses et oléagineux;pommes de terre et autres tubercules;-;111;69,6;1,53;23,7;0,5;4,1;0,17;0,037;0,006;0,076;-;0,023;17;0,54;21;0,24;55;816;17,1;83;0;0;-;0,11;0,032;0,29;-
53503;Igname, épluchée, bouillie/cuite à l'eau;;fruits, légumes, légumineuses et oléagineux;pommes de terre et autres tubercules;-;109;70,1;1,49;23,6;0,49;3,9;0,14;0,029;0,005;0,06;-;0,02;14;0,52;18;0,2;49;670;12,1;73;0;0;-;0,095;0,028;0,23;-
53672;Igname, crue;;fruits, légumes, légumineuses et oléagineux;pommes de terre et autres tubercules;-;111;69,6;1,25;23,9;-;4,1;0,2;0,038;0,006;0,075;0,012;0,023;17;0,54;21;0,24;55;816;0;-;0;0;-;0,11;0,032;0,29;-
54031;Manioc, racine crue;;fruits, légumes, légumineuses et oléagineux;pommes de terre et autres tubercules;-;157;59,7;1,36;36,3;1,7;1,8;0,28;0,074;0,075;0,048;0,017;0,035;16;0,27;21;0,34;27;271;20,6;8;0;0;-;0,087;0,048;0,088;-
54034;Manioc, racine cuite;;fruits, légumes, légumineuses et oléagineux;pommes de terre et autres tubercules;-;135;65,2;0,69;32,8;-;0,4;0,043;-;-;-;-;-;12,1;0,6;-;0,35;40,5;-;13,1;-;-;-;-;0,023;0,018;-;-
20293;Haricot coco, bouilli/cuit à l'eau;;fruits, légumes, légumineuses et oléagineux;légumineuses;légumineuses cuites;130;61,3;9,63;13,7;1,1;15,8;0,5;0,11;0,06;0,28;0,16;0,023;72;2,7;53;1,2;180;480;1,62;15,6;< 0,25;-;-;0,17;0,02;0,065;-
20360;Lentille, bouillie/cuite à l'eau (aliment moyen);;fruits, légumes, légumineuses et oléagineux;légumineuses;légumineuses cuites;125;64,8;10,1;16,2;0,2;8,45;0,57;0,092;0,13;0,18;0,032;0,015;39,3;2,45;33,9;1,25;159;215;< 0,5;16,7;< 0,25;-;-;0,094;0,022;0,11;-
20500;Fève, bouillie/cuite à l'eau;;fruits, légumes, légumineuses et oléagineux;légumineuses;légumineuses cuites;83,3;77,9;8,06;9,35;0,4;3,1;0,8;0,16;0,08;0,49;0,04;0,025;37;1,5;37;1;160;200;< 0,5;206;0;0;-;0,043;0,064;0,037;-
20502;Haricot blanc, bouilli/cuit à l'eau;;fruits, légumes, légumineuses et oléagineux;légumineuses;légumineuses cuites;112;66,9;6,75;12;0,3;13,8;1,1;0,25;0,15;0,61;0,37;0,023;120;1,7;33;0,67;110;260;< 0,5;5,48;< 0,25;0;-;0,03;0,017;0,039;-
20503;Haricot rouge, bouilli/cuit à l'eau;;fruits, légumes, légumineuses et oléagineux;légumineuses;légumineuses cuites;116;65;9,63;12,3;0,5;11,6;0,6;0,19;0,16;0,24;0,13;0,021;55;2,3;39;0,94;150;300;< 0,5;< 5;< 0,25;0;-;0,12;0,022;0,067;-
20506;Pois cassé, bouilli/cuit à l'eau;;fruits, légumes, légumineuses et oléagineux;légumineuses;légumineuses cuites;129;64,9;8,6;16,3;3,85;7,95;1,49;0,16;0,33;0,66;-;0,011;24,7;2,09;20,9;0,65;134;327;0,85;10;0;0;-;0,15;0,06;0,094;-
20507;Pois chiche, bouilli/cuit à l'eau;;fruits, légumes, légumineuses et oléagineux;légumineuses;légumineuses cuites;148;62;8,31;17,7;0,3;8,2;3;0,46;0,82;1,59;0,08;0,027;72;1,3;44;1,1;140;170;< 0,5;13;< 0,25;-;-;0,06;0,027;0,09;-
20508;Haricot flageolet, appertisé, égoutté;;fruits, légumes, légumineuses et oléagineux;légumineuses;légumineuses cuites;92,9;72;6,1;12,2;traces;6,3;0,79;0,11;0,016;0,14;-;0,73;63,1;1,3;26,5;< 0,1;86;281;< 1;< 50;0;0;-;0,07;0,16;0,05;0,37
20510;Lentille, cuisinée, appertisée, égouttée;;fruits, légumes, légumineuses et oléagineux;légumineuses;légumineuses cuites;90,4;73,5;6,83;12,3;0,67;4;0,64;0,1;0,12;0,25;0,049;0,65;21;1,67;15,8;0,55;82,7;178;traces;25;0;0;-;0,083;0,043;0,12;0,19
20511;Haricot blanc, appertisé, égoutté;;fruits, légumes, légumineuses et oléagineux;légumineuses;légumineuses cuites;85,5;72,9;5,88;10,9;0,75;7;0,5;0,15;0,026;0,13;-;0,69;70,7;2,99;38,4;1,12;91;362;0;traces;0;0;-;0,096;0,037;0,075;-
20513;Haricot flageolet, bouilli/cuit à l'eau;;fruits, légumes, légumineuses et oléagineux;légumineuses;légumineuses cuites;112;66,9;6,75;12;0,3;13,8;1,1;0,25;0,15;0,61;0,37;0,023;120;1,7;33;0,67;110;260;< 0,5;5,48;< 0,25;traces;-;0,03;0,017;0,039;-
20524;Haricot rouge, appertisé, égoutté;;fruits, légumes, légumineuses et oléagineux;légumineuses;légumineuses cuites;108;68,9;8,31;13;1;7;0,97;0,41;0,052;0,35;0,23;0,68;58;1,5;29;0,74;118;250;0,2;0;0;0;-;0,06;0,015;-;-
20531;Haricot mungo, frais, bouilli/cuit à l'eau;;fruits, légumes, légumineuses et oléagineux;légumineuses;légumineuses cuites;95,7;72,5;7,54;11,9;2,01;6,4;0,55;0,038;0,029;0,36;-;0,018;53;1,75;63;0,83;156;231;1;19;0;0;-;0,15;0,075;0,058;-
20532;Pois chiche, appertisé, égoutté;;fruits, légumes, légumineuses et oléagineux;légumineuses;légumineuses cuites;122;72,1;6,74;15;0,5;5,45;2,68;0,3;0,47;0,92;0,032;0,54;41,2;1,15;27,5;0,93;82,5;135;0,1;11,5;0;0;-;0,03;0,015;0,29;-
20540;Haricot flageolet, vert, bouilli/cuit à l'eau;;fruits, légumes, légumineuses et oléagineux;légumineuses;légumineuses cuites;115;66;8,5;13;0,71;10,2;0,91;0,18;0,12;0,43;0,29;0,038;115;2,2;43,4;1;131;338;< 2;< 30;< 0,1;0;-;0,09;0,03;0,07;-
20542;Fève, pelée, fraîche, surgelée, bouillie/cuite à l'eau;;fruits, légumes, légumineuses et oléagineux;légumineuses;légumineuses cuites;71,9;80,7;6,4;9;< 0,2;2,9;0,5;0,11;0,08;0,28;0,02;0,018;31;1,3;22;0,62;97;97;< 0,5;83,6;< 0,25;-;-;0,043;0,038;0,042;-
20543;Fève, fraîche, surgelée, bouillie/cuite à l'eau;;fruits, légumes, légumineuses et oléagineux;légumineuses;légumineuses cuites;63,6;80,5;5,6;7,4;1;5,8;< 0,5;< 0,01;< 0,01;< 0,01;< 0,01;0,02;61;0,93;26;0,55;88;150;< 0,5;102;< 0,25;-;-;0,061;0,055;0,038;-
20587;Lentille verte, bouillie/cuite à l'eau;;fruits, légumes, légumineuses et oléagineux;légumineuses;légumineuses cuites;125;64,8;10,1;16,2;0,2;8,45;0,58;0,093;0,13;0,18;0,032;0,015;39,5;2,45;34;1,25;160;215;< 0,5;16,8;< 0,25;-;-;0,094;0,022;0,11;-
20588;Lentille blonde, bouillie/cuite à l'eau;;fruits, légumes, légumineuses et oléagineux;légumineuses;légumineuses cuites;122;66,4;9,7;16,3;0,4;6;0,7;0,13;0,18;0,34;0,06;< 0,13;32;2,5;31;1,1;120;230;< 0,5;13,6;< 0,25;-;-;0,087;< 0,01;0,13;-
20589;Lentille corail, bouillie/cuite à l'eau;;fruits, légumes, légumineuses et oléagineux;légumineuses;légumineuses cuites;123;65,1;10,6;15;0,26;8,2;0,5;0,09;0,13;0,28;0,06;< 0,13;21;2,2;25;1,3;110;190;< 0,5;12,5;< 0,25;-;-;0,12;< 0,01;0,082;-
20700;Légume sec, cuit (aliment moyen);;fruits, légumes, légumineuses et oléagineux;légumineuses;légumineuses cuites;113;67,3;8,22;13,8;0,24;9,52;0,78;0,15;0,11;0,31;0,16;0,16;68,3;1,96;32,6;0,82;130;243;0,31;20,3;< 0,19;-;-;0,07;0,049;0,074;-
20517;Fève à écosser, fraîche, crue;;fruits, légumes, légumineuses et oléagineux;légumineuses;légumineuses fraîches;61,5;76,8;6,76;4,2;0,37;5,85;0,67;0,13;0,061;0,33;-;0,094;29,5;1,73;35,5;0,79;112;291;18,4;196;0;0;-;0,15;0,2;0,071;-
20527;Pois d'Angole vert, frais, cru;;fruits, légumes, légumineuses et oléagineux;légumineuses;légumineuses fraîches;129;65,9;7,2;18,8;3;5,1;1,64;0,35;0,013;0,87;-;0,013;42;1,6;68;1,04;127;552;39;40;0;0;-;0,4;0,17;0,068;-
20529;Haricot de Lima ou pois savon ou pois du Cap ou pois souche, cru;;fruits, légumes, légumineuses et oléagineux;légumineuses;légumineuses fraîches;105;70,2;6,84;15,3;1,48;4,9;0,86;0,2;0,05;0,42;-;0,02;34;3,14;58;0,78;136;467;23,4;126;0;0;-;0,22;0,1;0,2;-
20537;Haricot flageolet, frais, surgelé, cru;;fruits, légumes, légumineuses et oléagineux;légumineuses;légumineuses fraîches;153;55,1;9,32;25,6;0,4;4,4;0,52;0,1;-;-;-;0,78;-;-;-;-;-;-;-;-;-;-;-;-;-;-;-
20541;Fève, pelée, fraîche, surgelée, crue;;fruits, légumes, légumineuses et oléagineux;légumineuses;légumineuses fraîches;99,3;75,8;9,55;12,2;2,08;5,05;0,26;0,1;-;-;-;0,03;-;-;-;-;-;-;-;-;-;-;-;-;-;-;-
20359;Lentille, sèche (aliment moyen);;fruits, légumes, légumineuses et oléagineux;légumineuses;légumineuses sèches;327;9,49;25,1;44,5;1,1;16,3;1,8;0,24;0,45;0,95;0,21;< 0,13;63,7;6,31;96,8;3,4;478;937;1,61;36,6;< 0,25;-;-;0,29;0,046;0,35;-
20501;Haricot blanc, sec;;fruits, légumes, légumineuses et oléagineux;légumineuses;légumineuses sèches;307;11,3;23,4;43,9;-;15,2;0,85;0,22;0,074;0,36;-;0,04;240;10,4;190;3,67;301;1800;0;0;0;0;-;0,44;0,15;0,32;-
20515;Pois cassé, sec;;fruits, légumes, légumineuses et oléagineux;légumineuses;légumineuses sèches;347;2,36;23,8;47,5;2,56;25,5;1,16;0,16;0,24;0,5;0,083;0,038;37;4,82;49;3,55;321;823;1,8;89;0;0;-;0,73;0,22;0,17;-
20516;Pois chiche, sec;;fruits, légumes, légumineuses et oléagineux;légumineuses;légumineuses sèches;350;7,68;20,5;47,5;2,3;12,2;6,04;0,6;1,38;2,73;0,1;0,06;57;4,31;79;2,76;252;718;4;40;0;0;-;0,48;0,21;0,54;-
20518;Fève, sèche;;fruits, légumes, légumineuses et oléagineux;légumineuses;légumineuses sèches;301;11;26,1;33,3;5,7;25;1,53;0,25;0,3;0,63;-;0,033;103;6,7;192;3,14;421;1060;1,4;32;0;0;-;0,56;0,33;0,37;-
20525;Haricot rouge, sec;;fruits, légumes, légumineuses et oléagineux;légumineuses;légumineuses sèches;314;11,8;22,5;46,1;2,1;15,2;1,06;0,15;0,082;0,59;-;0,03;83;6,69;138;2,79;406;1360;4,5;0;0;0;-;0,61;0,22;0,4;-
20530;Haricot mungo, sec;;fruits, légumes, légumineuses et oléagineux;légumineuses;légumineuses sèches;343;6,89;25,2;47,6;-;18,3;1,64;0,11;0,085;1,07;0,028;0,095;138;7,57;267;3,35;379;983;0;-;0;0;-;0,27;0,25;0,28;-
20534;Lupin, graine, sec;;fruits, légumes, légumineuses et oléagineux;légumineuses;légumineuses sèches;356;10,4;36,2;21,5;-;18,9;9,74;1,16;3,94;2,44;-;0,038;176;4,36;198;4,75;440;1010;4,8;0;0;0;-;0,64;0,22;0,36;-
20535;Lentille corail, sèche;;fruits, légumes, légumineuses et oléagineux;légumineuses;légumineuses sèches;328;8,8;27,7;44,9;1,29;15,4;0,8;0,14;0,23;0,37;0,09;< 0,13;29;6,3;74;3,9;330;750;< 0,5;29,9;< 0,25;0;-;0,32;0,018;0,41;-
20539;Haricot flageolet, vert, sec;;fruits, légumes, légumineuses et oléagineux;légumineuses;légumineuses sèches;315;8,5;19,1;42,1;-;23,4;2,6;0,35;0,24;1,49;1,02;0,02;-;7,3;160;2,3;440;-;< 0,5;27;< 0,5;-;-;0,31;0,03;0,41;-
20585;Lentille verte, sèche;;fruits, légumes, légumineuses et oléagineux;légumineuses;légumineuses sèches;327;9,5;25,1;44,5;1,1;16,4;1,8;0,24;0,45;0,95;0,21;< 0,13;64;6,3;97;3,4;480;940;1,63;36,7;< 0,25;-;-;0,29;0,046;0,35;-
20586;Lentille blonde, sèche;;fruits, légumes, légumineuses et oléagineux;légumineuses;légumineuses sèches;339;8,8;26,1;48,3;1,4;12,1;1,9;0,32;0,52;0,94;0,21;< 0,13;54;7,4;91;3;360;780;< 0,5;30,7;< 0,25;-;-;0,32;0,029;0,44;-
13000;Abricot, dénoyauté, cru;Prunus armeniaca L.;fruits, légumes, légumineuses et oléagineux;fruits;fruits crus;44,1;87,1;0,81;9,01;6,7;1,7;< 0,5;< 0,01;< 0,01;< 0,01;< 0,01;< 0,013;15;0,19;8,4;0,09;22;260;2,55;2350;0;0;-;0,03;0,013;0,054;-
13002;Ananas, chair sans peau, cru;Ananas comosus (L.) Merril;fruits, légumes, légumineuses et oléagineux;fruits;fruits crus;51,6;85,5;0,25;11,7;10,5;1,2;< 0,5;< 0,01;< 0,01;< 0,01;< 0,01;< 0,013;8;0,17;15;0,08;8,1;140;46,1;66,9;0;0;-;0,056;0,033;0,052;-
13005;Banane, chair sans peau, crue;Musa spp.;fruits, légumes, légumineuses et oléagineux;fruits;fruits crus;87,6;75,8;1,06;19,7;15,6;2,7;< 0,5;< 0,01;< 0,01;< 0,01;< 0,01;< 0,013;5,1;0,2;28;0,14;29;320;7,16;28,5;0;0;-;0,054;< 0,01;0,18;-
13007;Cassis, cru;Ribes nigrum;fruits, légumes, légumineuses et oléagineux;fruits;fruits crus;70,2;80,9;1,4;9,68;9,68;7,13;0,41;0,034;0,058;0,18;0,06;0,005;55;1,54;24;0,27;59;322;181;100;0;0;-;0,05;0,05;0,066;1,37
13008;Ceriser, chair et peau, sans noyau, crue;Prunus avium L. ;fruits, légumes, légumineuses et oléagineux;fruits;fruits crus;53,7;85,7;0,81;13;10;1,6;< 0,3;< 0,01;< 0,01;< 0,01;< 0,01;< 0,013;9,9;0,17;8,8;0,06;19;190;4,09;242;0;0;-;< 0,015;0,012;0,04;-
13009;Citron, chair sans peau, sans pépins, cru;Citrus limon (L.) Burm. f.;fruits, légumes, légumineuses et oléagineux;fruits;fruits crus;24,3;91,3;0,25;1,56;0,8;< 0,5;< 0,5;< 0,01;< 0,01;< 0,01;< 0,01;< 0,013;11;0,15;7,9;0,33;12;140;45;< 5;0;0;-;0,043;< 0,01;0,023;-
13010;Coing, cru;Cydonia vulgaris;fruits, légumes, légumineuses et oléagineux;fruits;fruits crus;59;83,8;0,4;12,5;6,3;1,9;0,1;0,01;0,036;0,05;0;0,01;11;0,7;8;0,04;17;197;15;-;0;0;-;0,02;0,03;0,04;0,55
13012;Figue, crue;Ficus carica L.;fruits, légumes, légumineuses et oléagineux;fruits;fruits crus;67,6;80,2;1,19;13,5;12,2;4,1;< 0,5;< 0,01;< 0,01;< 0,01;< 0,01;0,013;57;0,27;22;0,16;21;230;< 0,5;73,6;0;0;-;< 0,015;< 0,01;0,059;-
13014;Fraise, crue;Fragaria x ananassa Duchene ex Rozier;fruits, légumes, légumineuses et oléagineux;fruits;fruits crus;35,1;90,3;0,63;6,03;5,6;3,8;< 0,5;< 0,01;< 0,01;< 0,01;< 0,01;< 0,013;18;0,19;12;0,11;23;140;54;< 5;0;0;-;< 0,015;< 0,01;0,04;-
13015;Framboise, crue;Rubus idaeus L.;fruits, légumes, légumineuses et oléagineux;fruits;fruits crus;47,9;86,8;1,19;5,83;5,4;4,3;0,8;0,13;0,16;0,43;0,16;< 0,013;16;0,4;20;0,24;29;170;18,7;100;0;0;-;< 0,015;0,02;0,032;-
13016;Fruit de la passion ou maracudja, chair sans peau, avec pépins, cru;Passiflora edulis Sims.;fruits, légumes, légumineuses et oléagineux;fruits;fruits crus;102;73,6;2,13;10,9;8,5;6,8;3;0,54;0,49;1,82;0,17;< 0,013;8,1;0,56;26;0,76;46;240;25,6;1010;0;0;-;< 0,015;0,053;0,17;-
13018;Grenade, chair sans peau, avec pépins, crue;Punica granatum L.;fruits, légumes, légumineuses et oléagineux;fruits;fruits crus;81;79,4;1,44;14,3;13,3;2,3;1,2;0,07;0,07;0,96;< 0,01;< 0,013;9,5;0,17;12;0,22;27;230;9,02;12,1;0;0;-;0,054;< 0,01;0,032;-
13019;Groseille, crue;Ribes rubrum;fruits, légumes, légumineuses et oléagineux;fruits;fruits crus;67,2;82,1;1,56;7,06;6,63;4,6;0,7;0,21;0,11;0,38;0,14;< 0,013;38;0,35;12;0,15;38;230;29,8;25,6;0;0;-;0,041;< 0,01;0,03;-
13021;Kiwi, chair sans peau, avec pépins, cru;Actinidia sinensis Planch.;fruits, légumes, légumineuses et oléagineux;fruits;fruits crus;60,9;83,5;0,88;11;8,9;2,4;0,6;0,13;0,16;0,25;0,18;< 0,013;29;0,16;12;0,12;26;290;81,9;38;0;0;-;< 0,015;0,021;0,036;-
13023;Litchi, chair sans peau, sans noyau, cru;Litchi chinensis Sonn.;fruits, légumes, légumineuses et oléagineux;fruits;fruits crus;77,5;80,5;1,13;16,1;15,7;2;< 0,5;< 0,01;< 0,01;< 0,01;< 0,01;< 0,013;3,6;0,26;18;0,23;27;200;19,2;< 5;0;0;-;< 0,015;< 0,01;0,12;-
13024;Clémentine ou mandarine, chair sans peau, sans pépins, crue;Citrus clementina hort. ex Tanaka or Citrus reticulata Blanco;fruits, légumes, légumineuses et oléagineux;fruits;fruits crus;45,5;87;0,81;9,17;8,6;1,7;< 0,5;< 0,01;< 0,01;< 0,01;< 0,01;< 0,013;23;0,09;9,3;0,1;18;140;49,2;147;0;0;-;0,064;< 0,01;0,079;-
13025;Mangue, chair sans peau, sans noyau, crue;Mangifera indica L.;fruits, légumes, légumineuses et oléagineux;fruits;fruits crus;71,1;81,1;0,63;14,3;12,9;1,6;< 0,5;< 0,01;< 0,01;< 0,01;< 0,01;< 0,013;12;0,09;11;0,11;12;150;25;864;0;0;-;< 0,015;< 0,01;0,1;-
13026;Melon cantaloup (par ex.: Charentais), chair sans peau, sans pépins, cru;Cucumis melo L.;fruits, légumes, légumineuses et oléagineux;fruits;fruits crus;59,8;84,2;1,13;14,8;10,6;1,3;< 0,5;< 0,01;< 0,01;< 0,01;< 0,01;0,06;11;0,21;16;0,18;17;380;8,14;2500;0;0;-;< 0,015;< 0,01;0,055;-
13027;Prune mirabelle, sans noyau, crue;Prunus domestica L. subsp. Syriaca;fruits, légumes, légumineuses et oléagineux;fruits;fruits crus;74,6;78,1;0,63;18;13,3;2,2;< 0,5;< 0,01;< 0,01;< 0,01;< 0,01;< 0,013;11;0,13;8,2;0,11;21;240;5,29;346;-;-;-;-;0,015;0,074;-
13028;Myrtille, crue;Vaccinium spp.;fruits, légumes, légumineuses et oléagineux;fruits;fruits crus;57,7;84,2;0,87;10,6;9,96;2,4;0,33;0,028;0,047;0,15;-;0,0025;6;0,28;6;0,16;12;77;9,7;32;0;0;-;0,037;0,041;0,052;-
13029;Mûre (de ronce), crue;Rugus spp.;fruits, légumes, légumineuses et oléagineux;fruits;fruits crus;46;86,1;1,13;6,53;6,1;5,2;0,7;0,07;0,15;0,43;0,08;< 0,013;31;0,4;20;0,18;25;200;10,1;156;0;0;-;< 0,015;0,02;0,015;-
13034;Orange, chair sans peau, sans pépins, crue;Citrus sinensis (L.) Osbeck;fruits, légumes, légumineuses et oléagineux;fruits;fruits crus;42;87,3;0,75;8,03;7,6;2,7;< 0,5;< 0,01;< 0,01;< 0,01;< 0,01;< 0,013;66;0,57;15;0,25;38;180;47,5;< 5;0;0;-;0,045;< 0,01;< 0,01;-
13035;Papaye, chair sans peau, crue;Carica papaya L.;fruits, légumes, légumineuses et oléagineux;fruits;fruits crus;39,6;88,8;0,75;8,53;8,1;1,8;< 0,3;< 0,01;< 0,01;< 0,01;< 0,01;< 0,013;22;0,16;18;< 0,05;8,7;200;65,3;351;0;0;-;0,017;0,017;0,02;-
13036;Pastèque, chair sans peau, sans pépins, crue;Citrullus vulgaris Schraders or Citrullus lanatus (Thunb.) Matsum;fruits, légumes, légumineuses et oléagineux;fruits;fruits crus;35,4;91;0,69;8,33;7,9;0,5;< 0,5;< 0,01;< 0,01;< 0,01;< 0,01;< 0,013;6;0,16;11;0,09;9,7;100;4,26;1220;0;0;-;0,015;0,01;0,064;-
13037;Poire, chair et peau, crue;Pyrus communis L.;fruits, légumes, légumineuses et oléagineux;fruits;fruits crus;56,6;83,5;0,36;12,3;9,75;2,9;0,27;0,067;0,084;0,094;0,012;0,0045;6,46;0,072;8,23;0,097;12;132;4,3;14;0;0;-;0,012;0,026;0,029;-
13039;Pomme, chair et peau, crue;Malus domestica Borkhausen;fruits, légumes, légumineuses et oléagineux;fruits;fruits crus;54;85,4;0,25;11,6;10,6;1,4;0,25;0,052;0,007;0,051;0,0049;0,0037;5,34;0,099;6,47;0,031;11,4;119;4,6;21,4;0;0;-;0,016;0,026;0,044;-
13040;Pomelo (dit Pamplemousse), chair sans peau, sans pépins, cru;Citrus paradisi Macf.;fruits, légumes, légumineuses et oléagineux;fruits;fruits crus;33,5;90;0,84;5,92;5,87;1,1;< 0,5;< 0,15;< 0,15;< 0,15;< 0,15;< 2;23;< 0,25;9,97;< 0,5;19,7;171;36,4;350;< 0,1;0;-;0,06;0,02;0,06;-
13041;Prune Reine-Claude, sans noyau, crue;Prunus domestica var.italica Borkh;fruits, légumes, légumineuses et oléagineux;fruits;fruits crus;69;80,1;0,94;16,4;10,4;1,7;< 0,5;< 0,01;< 0,01;< 0,01;< 0,01;< 0,013;13;0,16;9,5;0,12;20;250;4,16;430;0;0;-;< 0,015;< 0,01;0,049;-
13043;Pêche, chair et peau, sans noyau, crue;Prunus persica;fruits, légumes, légumineuses et oléagineux;fruits;fruits crus;37,9;88,9;0,91;7,55;6,83;1,5;0,25;0,019;0,067;0,086;0,0022;< 0,0028;7,32;0,15;11,2;0,12;20;215;6,6;162;0;0;-;0,024;0,031;0,025;-
13044;Raisin blanc, à gros grain (type Italia ou Dattier), cru;Vitis vinifera L.;fruits, légumes, légumineuses et oléagineux;fruits;fruits crus;71,6;80,9;0,75;16,6;15,5;1;< 0,5;< 0,01;< 0,01;< 0,01;< 0,01;< 0,013;12;0,2;7,6;< 0,05;16;200;1,07;7,54;< 0,25;0;-;0,043;< 0,01;0,043;-
13045;Raisin noir, cru;Vitis vinifera L.;fruits, légumes, légumineuses et oléagineux;fruits;fruits crus;69,5;82,1;0,57;15,6;15,3;1,43;0,25;0,08;0,016;0,074;0,017;"<
0,00097";8,98;0,3;6,78;0,038;12,9;172;8,4;24;0;0;-;0,038;0,02;0,07;-
13047;Rhubarbe, tige, crue;Rheum rhabarbarum L.;fruits, légumes, légumineuses et oléagineux;fruits;fruits crus;18,1;93,6;0,73;1,12;1,1;1,8;0,16;0,041;0,03;0,077;0,019;0,0075;140;0,26;15;0,1;13;198;6,4;62,5;0;0;-;0,026;0,03;0,025;-
13054;Carambole, chair et peau, crue;Averrhoa carambola L.;fruits, légumes, légumineuses et oléagineux;fruits;fruits crus;28,4;91,4;1,04;3,83;3,83;2,8;0,33;0,019;0,03;0,18;-;0,005;3;0,08;10;0,12;12;133;34,4;25;0;0;-;0,014;0,016;0,017;-
13055;Cerise acérola, chair et peau, sans noyau, crue;Malpighia punicifolia L.;fruits, légumes, légumineuses et oléagineux;fruits;fruits crus;-;91,4;0,4;6,59;-;1,1;0,3;0,068;0,082;0,09;-;0,018;12;0,2;18;0,1;11;146;1680;-;-;0;-;0,02;0,06;0,009;-
13056;Anone ou chérimole, chair sans peau, crue;Annona cherimola Mill.;fruits, légumes, légumineuses et oléagineux;fruits;fruits crus;80;79,4;1,57;15,4;12,9;3;0,68;0,23;0,055;0,19;0,16;0,018;10;0,27;17;0,16;26;287;12,6;2;0;0;-;0,1;0,13;0,26;-
13061;Feijoa, chair sans peau, crue;Feijoa sellowiana Berg.;fruits, légumes, légumineuses et oléagineux;fruits;fruits crus;-;83,3;0,71;8,2;8,2;6,4;0,42;0,1;0,056;0,14;0,029;0,0075;17;0,14;9;0,06;19;172;32,9;2;-;0;-;0,006;0,018;0,067;-
13063;Figue de Barbarie, chair et peau, avec pépins, crue;Opuntia ficus-indica (L.) Mill.;fruits, légumes, légumineuses et oléagineux;fruits;fruits crus;51,5;83;0,12;9,79;1,02;5,3;0,11;0,01;0,01;0,04;-;0,01;180;0,2;69;0,14;11;130;11;60;0;0;-;0,008;0,032;0,079;0,01
13066;Kaki, chair et peau, cru;Diospyros kaki L. f.;fruits, légumes, légumineuses et oléagineux;fruits;fruits crus;66;81,8;0,88;14,3;13,9;3,4;< 0,3;< 0,01;< 0,01;< 0,01;< 0,01;< 0,013;6,9;0,06;7,2;< 0,05;13;160;3,41;180;< 0,25;0;-;< 0,015;< 0,01;< 0,01;-
13067;Citron vert ou lime, chair sans peau, sans pépins, cru;Citrus aurantiifolia (Christm.) Swingle.;fruits, légumes, légumineuses et oléagineux;fruits;fruits crus;39,3;86,3;1,13;3,14;2,1;4,3;< 0,3;< 0,01;< 0,01;< 0,01;< 0,01;0,015;57;0,2;14;0,15;24;190;29,3;12,4;0;0;-;< 0,015;0,023;0,018;-
13071;Mûre noire (du mûrier), crue;Morus nigra L.;fruits, légumes, légumineuses et oléagineux;fruits;fruits crus;-;87,7;1,44;8,1;8,1;1,7;0,39;0,027;0,041;0,21;-;0,025;39;1,85;18;0,12;38;194;36,4;9;0;0;-;0,029;0,1;0,05;-
13077;Ramboutan ou rambutan, chair sans peau, sans noyau, crue;Nephelium lappaceum L.;fruits, légumes, légumineuses et oléagineux;fruits;fruits crus;-;78;0,65;20;-;0,9;0,21;-;-;-;-;0,028;22;0,35;7;0,08;9;42;4,9;2;-;0;-;0,013;0,022;0,02;-
13080;Tamarin, fruit mûr, chair sans peau, avec pépins, cru;Tamarindus indica L.;fruits, légumes, légumineuses et oléagineux;fruits;fruits crus;-;31,4;2,8;57,4;38,8;5,1;0,6;0,27;0,18;0,059;0;0,07;74;2,8;92;0,1;113;628;3,5;18;0;0;-;0,43;0,15;0,066;-
13083;Goyave, chair sans peau, crue;Psidium guajava L.;fruits, légumes, légumineuses et oléagineux;fruits;fruits crus;68,3;80,8;2,55;9,02;8,92;5,4;0,95;0,27;0,087;0,4;0,059;0,005;18;0,26;22;0,23;40;417;228;374;0;0;-;0,067;0,04;0,11;-
13085;Pomme Canada, chair sans peau, crue;Malus domestica Borkhausen Reinette grise du Canada;fruits, légumes, légumineuses et oléagineux;fruits;fruits crus;51,1;84,4;0,4;11,6;11;1,6;0,1;-;-;-;-;0,0092;3,59;0,14;3,76;0,09;8,61;154;4;-;0;0;-;0,03;0,02;0,06;0,27
13086;Pomme Golden, chair sans peau, crue;Malus domestica Borkhausen Golden Delicious;fruits, légumes, légumineuses et oléagineux;fruits;fruits crus;50,4;85,5;0,25;11,7;11,3;2,5;< 0,5;< 0,01;< 0,01;< 0,01;< 0,01;< 0,013;2,8;0,06;3,5;< 0,05;8,8;110;1,29;59,8;-;-;-;< 0,015;< 0,01;0,052;-
13100;Prune, sans noyau, crue;Prunus domestica L.;fruits, légumes, légumineuses et oléagineux;fruits;fruits crus;51,6;87,2;0,7;9,92;9,92;1,4;0,28;0,017;0,13;0,044;0,015;0;6;0,17;7;0,1;16;157;9,5;190;0;0;-;0,028;0,026;0,029;-
13101;Raisin Chasselas, cru;Vitis vinifera L.;fruits, légumes, légumineuses et oléagineux;fruits;fruits crus;77,8;79,4;0,75;16,9;16,5;2;0,5;0,12;0,13;0,23;< 0,01;< 0,013;16;0,14;7,5;0,07;21;150;4,14;27,4;-;-;-;0,031;0,056;0,054;-
13110;Griotte, crue;Prunus cerasus;fruits, légumes, légumineuses et oléagineux;fruits;fruits crus;-;86,1;1;10,6;8,49;1,6;0,3;0,068;0,082;0,09;-;0,0075;16;0,32;9;0,1;15;173;10;770;0;0;-;0,03;0,04;0,044;-
13113;Canneberge ou cranberry, crue;Vaccinium oxycoccus L.;fruits, légumes, légumineuses et oléagineux;fruits;fruits crus;-;86,6;0,88;7,6;4,04;5,65;0,17;0,011;0,018;0,055;-;0,035;14;0,63;6;0,1;14;113;14,2;36;0;0;-;0,012;0,015;0,057;-
13121;Pomme Granny Smith, chair sans peau, crue;Malus domestica Borkhausen Granny Smith;fruits, légumes, légumineuses et oléagineux;fruits;fruits crus;51;85,3;0,25;11,4;10,6;2,6;< 0,5;< 0,01;< 0,01;< 0,01;< 0,01;< 0,013;3,2;0,08;2,9;< 0,05;7,6;110;2,21;12,8;-;-;-;< 0,015;< 0,01;0,029;-
13122;Pomme Granny Smith, chair et peau, crue;Malus domestica Borkhausen Granny Smith;fruits, légumes, légumineuses et oléagineux;fruits;fruits crus;48,6;85,8;0,25;10,7;10,1;2,8;< 0,5;< 0,01;< 0,01;< 0,01;< 0,01;< 0,013;3,2;0,06;2,8;< 0,05;7,6;110;2,31;11,6;-;-;-;< 0,015;< 0,01;0,03;-
13125;Citron, zeste, cru;Citrus limon (L.) Burm. f.;fruits, légumes, légumineuses et oléagineux;fruits;fruits crus;-;81,6;1,5;5,4;4,17;10,6;0,3;0,039;0,011;0,089;0,026;0,015;134;0,8;15;0,25;12;160;129;7;0;0;-;0,06;0,08;0,17;-
